序号,股票代码,股票简称,公司名称,省份,城市,主营业务收入(202112),净利润(202112),员工人数,上市日期,招股书,公司财报,行业分类,产品类型,主营业务
397,000922,佳电股份,哈尔滨电气集团佳木斯电机股份有限公司,黑龙江,佳木斯市,--,--,1874,1999-06-18,--,,电机,矿用电机、永磁电机、防爆电机、核用电机、屏蔽电机、普通电机、同步电机、起重冶金电机,电机、屏蔽电机电泵制造与维修；电机、防爆电气技术开发、技术服务。
398,000923,河钢资源,河钢资源股份有限公司,河北,石家庄市,--,--,3923,1999-07-14,--,,工程机械,铜产品、磁铁矿、阳极泥、硫酸、推土机、蛭石,铜、铁矿石的开采、加工、销售。
399,000925,众合科技,浙江众合科技股份有限公司,浙江,杭州市,--,--,1469,1999-06-11,--,,轨道交通设备,智慧交通、泛半导体,智慧交通及泛半导体产业。
400,000926,福星股份,湖北福星科技股份有限公司,湖北,武汉市,--,--,3478,1999-06-18,--,,房地产开发,房地产、金属制品,房地产业和金属制品业。
401,000927,中国铁物,中国铁路物资股份有限公司,天津,天津市,591.45亿,10.67亿,4237,1999-07-27,--,,乘用车,油品供应链管理、钢轨供应链管理及运维技术服务、铁路移动装备物资供应、工程建设物资生产制造、工程建设物资集成服务、大宗商品贸易,以面向轨道交通产业为主的物资供应链管理及轨道运维技术服务和工程建设物资生产制造及集成服务。
402,000928,中钢国际,中钢国际工程技术股份有限公司,吉林,吉林市,158.62亿,6.62亿,1881,1999-03-12,--,,专业工程,工程总承包、国内外贸易、服务收入,工程总承包为主的工程技术服务业务、以机电设备及备品备件集成供应为主的国内外贸易业务和以工程设计、咨询为主的服务业务。
403,000929,兰州黄河,兰州黄河企业股份有限公司,甘肃,兰州市,--,--,1148,1999-06-23,--,,啤酒,啤酒、饮料、大麦麦芽,啤酒、麦芽、饮料的生产、加工和销售业务。
404,000930,中粮科技,中粮生物科技股份有限公司,安徽,蚌埠市,--,--,9565,1999-07-12,--,,燃料乙醇,燃料乙醇、食用酒精、淀粉、淀粉糖、柠檬酸、味精,燃料乙醇、食用酒精、淀粉、淀粉糖、柠檬酸、味精及其副产品的生产与销售。
405,000931,中关村,北京中关村科技发展(控股)股份有限公司,北京,北京市,--,--,2306,1999-07-12,--,,综合,生物医药、房地产建筑、物业管理、混凝土,生物医药、个人护理用品、养老服务业务和其他业务。
406,000932,华菱钢铁,湖南华菱钢铁股份有限公司,湖南,长沙市,--,--,23628,1999-08-03,--,,普钢,钢铁、其他,钢材产品的生产和销售。
407,000933,神火股份,河南神火煤电股份有限公司,河南,商丘市,344.52亿,30.48亿,22701,1999-08-31,--,,铝,采掘业、有色金属、电解铝深加工、贸易、房地产、电力、运输,铝产品、煤炭的生产、加工和销售及发供电。
408,000935,四川双马,四川和谐双马股份有限公司,四川,成都市,--,--,382,1999-08-24,--,,水泥,水泥、私募股权投资管理、骨料,建材生产业务、私募股权投资管理业务。
409,000936,华西股份,江苏华西村股份有限公司,江苏,无锡市,--,--,851,1999-08-10,--,,涤纶,纺织化纤、石化物流仓储、投资管理,涤纶化纤的研发、生产和销售，石化物流仓储服务。
410,000937,冀中能源,冀中能源股份有限公司,河北,邢台市,--,--,38063,1999-09-09,--,,煤炭开采洗选,煤炭、电力、建材、化工,煤炭、化工、电力、建材四大板块
411,000938,紫光股份,紫光股份有限公司,北京,北京市,676.38亿,37.92亿,17147,1999-11-04,--,,PC、服务器及硬件,网络设备、服务器、存储产品、云计算与云服务、安全产品及服务、智能终端,提供技术领先的网络、计算、存储、云计算、安全和智能终端等全栈ICT基础设施及服务。
412,000948,南天信息,云南南天电子信息产业股份有限公司,云南,昆明市,--,--,6454,1999-10-14,--,,专用计算机设备,软件和信息技术服务,提供金融行业数字化综合解决方案和服务。
413,000949,新乡化纤,新乡化纤股份有限公司,河南,新乡市,--,--,8786,1999-10-21,--,,粘胶纤维,化学纤维产品,化学纤维产品的生产和销售。
414,000950,重药控股,重药控股股份有限公司,重庆,重庆市,--,--,12498,1999-09-16,--,,氮肥,医药批发、医药零售,医药流通业务。
415,000951,中国重汽,中国重汽集团济南卡车股份有限公司,山东,济南市,560.99亿,16.69亿,7077,1999-11-25,--,,商用车,汽车制造,从事重型载重汽车、重型专用车底盘、车桥等汽车配件的制造及销售业务。
416,000952,广济药业,湖北广济药业股份有限公司,湖北,黄冈市,8.37亿,1.06亿,1317,1999-11-12,--,,化学原料药,原料系列产品、制剂系列产品,维生素原料产品的研发、生产和销售。
417,000953,河化股份,广西河池化工股份有限公司,广西,河池市,--,--,188,1999-12-02,--,,氮肥,医药中间体、尿素,医药中间体的研发、生产与销售业务以及尿素委托加工销售业务。
418,000955,欣龙控股,欣龙控股(集团)股份有限公司,海南,澄迈县,--,--,960,1999-12-09,--,,家纺,水刺产品、无纺深加工产品、热轧及服衬产品、熔纺无纺布、磷化工产品、贸易业务、医疗收入,从事非织造材料、磷化工业务
419,000957,中通客车,中通客车股份有限公司,山东,聊城市,--,--,4583,2000-01-13,--,,商用车,客车制造业,以客车为主兼顾零部件产品的开发、制造和销售。
420,000958,东方能源,国家电投集团东方新能源股份有限公司,河北,石家庄市,--,--,2836,1999-12-23,--,,其他发电,金融业务、能源业务,清洁能源发电及热电联产等业务，还涵盖财务公司、保险经纪、信托、期货、保险等多项金融业务。
421,000959,首钢股份,北京首钢股份有限公司,北京,北京市,--,--,18166,1999-12-16,--,,普钢,冶金,钢铁冶炼、钢压延加工、技术开发、技术咨询、技术转让、技术服务、技术培训。
422,000960,锡业股份,云南锡业股份有限公司,云南,红河哈尼族彝族自治州,--,--,15379,2000-02-21,--,,锡,锡锭、锡材、锡化工、铜产品、锌产品、贸易产品,锡、锌、铜、铟等金属矿的勘探、开采、选矿和冶炼及锡的深加工。
423,000961,中南建设,江苏中南建设集团股份有限公司,江苏,南通市,--,--,46615,2000-03-01,--,,专业工程,房地产开发、建筑施工、酒店,房地产开发和建筑施工。
424,000962,东方钽业,宁夏东方钽业股份有限公司,宁夏,石嘴山市,7.95亿,8895.51万,1122,2000-01-20,--,,其他金属新材料,有色金属材料,稀有金属钽、铌、铍及合金等的研发、生产、销售和进出口业务。
425,000963,华东医药,华东医药股份有限公司,浙江,杭州市,--,--,11359,2000-01-27,--,,医药商业,中药肾病系列、糖尿病系列、免疫抑制剂系列、消化道系列、心脑血管系列,覆盖医药全产业链，以医药工业为主导，同时拓展医药商业和医美产业，集医药研发、生产、经销。
426,000965,天保基建,天津天保基建股份有限公司,天津,天津市,--,--,115,2000-04-06,--,,房地产开发,房地产销售、物业出租、物业管理,房地产开发、物业出租、物业管理等业务。
427,000966,长源电力,国家能源集团长源电力股份有限公司,湖北,武汉市,--,--,3063,2000-03-16,--,,火电,电力、热力,电力、热力生产和经营。
428,000967,盈峰环境,盈峰环境科技集团股份有限公司,浙江,绍兴市,--,--,8725,2000-03-30,--,,电工机械制造,传统环卫装备、新能源环卫装备、环卫服务,以“智慧环卫”为核心，为客户在城乡保洁消毒、生活垃圾分类、固废垃圾清扫运处、环卫人员管理、餐厨垃圾收运、渣土运输监管、渗滤液处理、智慧城市建设等领域提供全新维度的全生命周期物联网集成应用解决方案和智慧平台运营服务。
429,000968,蓝焰控股,山西蓝焰控股股份有限公司,山西,太原市,--,--,2068,2000-06-22,--,,煤炭开采洗选,煤层气(煤矿瓦斯),煤矿瓦斯治理及煤层气勘探、开发与利用业务。
430,000969,安泰科技,安泰科技股份有限公司,北京,北京市,62.72亿,2.61亿,5566,2000-05-29,--,,其他金属新材料,高端粉末冶金材料及制品产业、先进功能材料及器件产业,先进金属材料的研发、生产与销售，包括能源用先进材料及制品，特种材料制品及装备，超硬材料及工具三个领域。
431,000970,中科三环,北京中科三环高技术股份有限公司,北京,北京市,71.46亿,4.77亿,5537,2000-04-20,--,,磁性材料,钕铁硼永磁材料、电动自行车,稀土永磁材料和新型磁性材料及其应用产品的研究开发、生产和销售。
432,000971,ST高升,高升控股股份有限公司,湖北,仙桃市,--,--,822,2000-04-27,--,,云服务(含IDC、CDN),网络通信服务、虚拟专用网服务、通信网络建设技术服务,以IDC(互联网数据中心)、CDN(内容分发网络)、APM(应用性能管理)为主的互联网基础云服务。
433,000972,*ST中基,中基健康产业股份有限公司,新疆,五家渠市,1.74亿,-1.01亿,149,2000-09-26,--,,番茄加工,大桶番茄酱、番茄红素胶囊、租赁服务,大包装浓缩番茄酱；去皮番茄和番茄丁、小罐番茄制品；番茄红素胶囊、番茄纤维片生产及销售。
434,000973,佛塑科技,佛山佛塑科技集团股份有限公司,广东,佛山市,24.57亿,1.61亿,3153,2000-05-25,--,,塑料制品,渗析材料、光电材料、阻隔材料,从事各类先进高分子新材料的生产与销售。
435,000975,银泰黄金,银泰黄金股份有限公司,内蒙古,锡林郭勒盟,--,--,1566,2000-06-08,--,,铅锌,有色金属矿采选业、金属商品贸易,贵金属和有色金属矿采选及金属贸易。
436,000976,华铁股份,广东华铁通达高铁装备股份有限公司,广东,江门市,--,--,876,2000-06-01,--,,轨道交通设备,高铁配件产品,轨道交通装备制造。
437,000977,浪潮信息,浪潮电子信息产业股份有限公司,山东,济南市,--,--,7131,2000-06-08,--,,PC、服务器及硬件,服务器及部件、IT终端及散件,服务器等云计算基础设施产品的研发、生产、销售。
438,000978,桂林旅游,桂林旅游股份有限公司,广西,桂林市,2.39亿,-2.34亿,2205,2000-05-18,--,,景区,旅游服务业,游船客运、景区旅游业务、酒店、公路旅行客运、出租车业务等。
439,000980,*ST众泰,众泰汽车股份有限公司,浙江,金华市,--,--,2143,2000-06-16,--,,乘用车,交通运输设备、门业产品,汽车整车研发、制造及销售。
440,000981,*ST银亿,银亿股份有限公司,甘肃,兰州市,--,--,10973,2000-06-22,--,,房地产开发,汽车零部件、房产销售、物业管理,高端制造业和房地产业。
441,000982,中银绒业,宁夏中银绒业股份有限公司,宁夏,银川市,4.33亿,4126.77万,177,2000-07-06,--,,纺织面料,纺织品,羊绒和羊绒制品贸易，并通过并购进入新能源锂电池正负极材料生产和销售。
442,000983,山西焦煤,山西焦煤能源集团股份有限公司,山西,太原市,--,--,33152,2000-07-26,--,,煤炭开采洗选,煤炭、电力热力、焦炭及化工产品,煤炭的生产、洗选加工、销售及发供电，矿山开发设计施工、矿用及电力器材生产经营等。
443,000985,大庆华科,大庆华科股份有限公司,黑龙江,大庆市,--,--,596,2000-07-26,--,,其他化学制品,化工、药品,石油化工产品的生产和销售，同时还包括进出口业务、仓储保管服务等其它业务。
444,000987,越秀金控,广州越秀金融控股集团股份有限公司,广东,广州市,133.14亿,33.30亿,1097,2000-07-18,--,,其他非银行金融,不良资产管理、投资管理、融资租赁、期货,不良资产管理、融资租赁、私募基金管理和资本投资等业务。
445,000988,华工科技,华工科技产业股份有限公司,湖北,武汉市,101.67亿,7.48亿,8270,2000-06-08,--,,电子零部件,激光加工及系列成套设备、光电器件系列产品、激光全息防伪系列产品、敏感元器件,激光技术及其应用
446,000989,九芝堂,九芝堂股份有限公司,湖南,长沙市,--,--,4552,2000-06-28,--,,中药生产,中成药、西成药、生物药品,中药研发、生产和销售等业务为核心，逐步探索布局干细胞、中医医疗健康服务、药食同源系列产品等创新业务。
447,000990,诚志股份,诚志股份有限公司,江西,南昌市,--,--,4469,2000-07-06,--,,其他化学制品,工业气体产品、液体化学产品,"工业气体及基础化工原料的综合运营,半导体显示材料的生产,销售生命科技产品的生产和销售以及工业大麻的种植,研究,加工及其产品的销售。"
448,000993,闽东电力,福建闽东电力股份有限公司,福建,宁德市,5.83亿,1.18亿,1702,2000-07-31,--,,水电,电力销售、商品房销售（住宅）、贸易业务,电力生产与开发。
449,000995,皇台酒业,甘肃皇台酒业股份有限公司,甘肃,武威市,--,--,388,2000-08-07,--,,白酒,粮食白酒、葡萄酒、鲜葡萄、葡萄原汁,白酒酿造与销售；葡萄酒酿造与销售；酿酒葡萄种植。
450,000996,中国中期,中国中期投资股份有限公司,北京,北京市,--,--,67,2000-07-18,--,,汽车服务,汽车服务业务、零售业务、基金业务,汽车服务业务。
451,000997,新大陆,新大陆数字技术股份有限公司,福建,福州市,--,--,6570,2000-08-07,--,,专用计算机设备,制造业、服务业,通过商户服务平台，为商户提供第三方支付服务、金融服务等商户综合运用服务；为电子支付行业和信息识别行业客户提供终端产品和系统解决方案；为移动通信行业和高速公路行业客户提供软件和系统开发等信息化服务。
452,000998,隆平高科,袁隆平农业高科技股份有限公司,湖南,长沙市,--,--,2763,2000-12-11,--,,种子,水稻种子、玉米种子,农作物高科技种子及种苗的研发、繁育、推广及服务。
453,000999,华润三九,华润三九医药股份有限公司,广东,深圳市,153.20亿,20.81亿,15420,2000-03-09,--,,中药生产,医药产品,医药产品的研发、生产、销售及相关健康服务。
454,001201,东瑞股份,东瑞食品集团股份有限公司,广东,河源市,--,--,837,2021-04-28,--,,--,生猪类产品、饲料类产品,生猪的养殖和销售。
455,001202,炬申股份,广东炬申物流股份有限公司,广东,佛山市,--,--,292,2021-04-29,--,,--,运输业务、仓储综合业务,为客户提供有色金属的运输服务（包括自有运输服务和货运代理服务）、仓储及其增值服务等综合物流服务。
456,001203,大中矿业,内蒙古大中矿业股份有限公司,内蒙古,巴彦淖尔市,48.95亿,16.25亿,3149,2021-05-10,--,,--,铁精粉、球团,铁矿石采选、铁精粉和球团生产销售、副产品机制砂石的加工销售。
457,001205,盛航股份,南京盛航海运股份有限公司,江苏,南京市,6.13亿,1.30亿,462,2021-05-13,--,,--,化学品运输业务、油品运输业务,从事国内沿海、长江中下游液体化学品、成品油水上运输业务。
458,001206,依依股份,天津市依依卫生用品股份有限公司,天津,天津市,--,--,1138,2021-05-18,--,,--,卫生护理用品、无纺布,一次性卫生护理用品及无纺布的研发、生产和销售。
459,001207,联科科技,山东联科科技股份有限公司,山东,潍坊市,--,--,556,2021-06-23,--,,--,二氧化硅、炭黑、硅酸钠,从事二氧化硅和炭黑的研发、生产与销售。
460,001208,华菱线缆,湖南华菱线缆股份有限公司,湖南,湘潭市,--,--,592,2021-06-24,--,,--,电缆,电线电缆的研发、生产及销售。
461,001209,洪兴股份,广东洪兴实业股份有限公司,广东,汕头市,--,--,1764,2021-07-23,--,,--,家居服、内衣内裤,家居服饰的研发、设计、生产及销售。
462,001210,金房节能,北京金房暖通节能技术股份有限公司,北京,北京市,--,--,696,2021-07-29,--,,--,供热运营服务、节能改造服务、节能产品,供热运营服务、供热领域节能改造服务和节能产品的研发、生产与销售。
463,001211,双枪科技,双枪科技股份有限公司,浙江,杭州市,--,--,1268,2021-08-05,--,,--,品筷子、砧板、签类、勺铲,日用餐厨具的生产、销售。
464,001212,中旗新材,广东中旗新材料股份有限公司,广东,佛山市,--,--,969,2021-08-23,--,,--,人造石英石板材、人造石英石台面,专业从事人造石英石装饰材料的研发、生产、销售和服务。
465,001213,中铁特货,中铁特货物流股份有限公司,北京,北京市,--,--,3386,2021-09-08,--,,--,商品汽车物流、冷链物流、大件货物物流,从事商品汽车物流、冷链物流和大件货物物流业务。
466,001215,千味央厨,郑州千味央厨食品股份有限公司,河南,郑州市,--,--,2074,2021-09-06,--,,--,定制化和标准化的速冻面米制品,面向餐饮企业的速冻面米制品的研发、生产和销售。
467,001216,华瓷股份,湖南华联瓷业股份有限公司,湖南,株洲市,12.04亿,1.40亿,5338,2021-10-19,--,,--,日用陶瓷、工业陶瓷,日用陶瓷制品的研发、设计、生产和销售。
468,001217,华尔泰,安徽华尔泰化工股份有限公司,安徽,池州市,--,--,907,2021-09-29,--,,--,基础化工产品、精细化工产品,化工产品的研发、生产与销售。
469,001218,丽臣实业,湖南丽臣实业股份有限公司,湖南,长沙市,27.49亿,1.79亿,716,2021-10-15,--,,--,表面活性剂、洗涤,表面活性剂和洗涤用品的研发、生产、销售。
470,001219,青岛食品,青岛食品股份有限公司,山东,青岛市,--,--,614,2021-10-21,--,,--,钙奶饼干、休闲饼干、花生酱,饼干与花生酱等休闲食品的研发、生产及销售。
471,001227,兰州银行,兰州银行股份有限公司,--,--,--,--,4032,2022-01-17,--,,--,公司银行业务、个人银行业务、资金业务,公司银行业务、零售银行业务和资金业务等。
472,001228,永泰运,永泰运化工物流股份有限公司,--,--,21.45亿,1.75亿,607,--,--,,--,跨境化工物流服务、仓储堆存、道路运输,跨境化工物流供应链服务。
473,001234,泰慕士,江苏泰慕士针纺科技股份有限公司,--,--,--,--,2181,2022-01-11,--,,--,针织服装、针织面料,针织面料与针织服装的研发、生产和销售。
474,001266,宏英智能,上海宏英智能科技股份有限公司,--,--,5.02亿,1.30亿,408,2022-02-28,--,,--,智能电控产品、智能电控总成,智能电控产品及智能电控总成的研发、生产、销售。
475,001267,汇绿生态,汇绿生态科技集团股份有限公司,--,--,--,--,403,2021-11-17,--,,--,林工程施工、园林景观设计、苗木种植,园林工程施工、园林景观设计及苗木种植等，能够完整的提供从苗木种植、园林工程设计、施工及后续绿化养护等全产业链服务。
476,001288,运机集团,四川省自贡运输机械集团股份有限公司,--,--,--,--,775,2021-11-01,--,,--,通用带式输送机、管状带式输送机、水平转弯带式输送机,从事以带式输送机为主的节能环保型输送机械成套设备的研发、设计、生产和销售。
477,001289,龙源电力,龙源电力集团股份有限公司,--,--,372.08亿,72.63亿,8053,2022-01-24,--,,--,电力,在中国风资源丰富的地区设计、开发、建设、管理及运营风电场，并向各地方电网公司销售电力。
478,001296,长江材料,重庆长江造型材料(集团)股份有限公司,--,--,--,--,846,2021-12-24,--,,--,柴油机系列、覆膜砂系列,"铸造用硅砂,覆膜砂和砂芯的研发,生产和销售；铸造废(旧)砂再生技术和设备的研发,生产；压裂支撑剂的研发,生产和销售。"
479,001308,康冠科技,深圳市康冠科技股份有限公司,--,--,118.89亿,9.24亿,6104,2022-03-18,--,,--,智能交互显示产品、智能电视,智能显示产品的研发、生产以及销售。
480,001313,粤海饲料,广东粤海饲料集团股份有限公司,--,--,--,--,3433,2022-02-16,--,,--,特种水产配合饲料、普通水产配合饲料,从事水产饲料研发、生产及销售，并以虾料、海水鱼料等特种水产饲料为主。
481,001317,三羊马,三羊马(重庆)物流股份有限公司,--,--,--,--,807,2021-11-30,--,,--,汽车整车综合物流服务、非汽车商品综合物流服务、仓储服务,从事汽车整车综合运输服务业务、非汽车商品综合运输服务业务、仓储服务。
482,001696,宗申动力,重庆宗申动力机械股份有限公司,重庆,重庆市,93.64亿,5.21亿,7656,1997-03-06,--,,汽车零部件,发动机、通机、产品零部件,从事小型热动力机械产品及部分终端产品的研发、制造、销售。
483,001872,招商港口,招商局港口集团股份有限公司,广东,深圳市,152.84亿,76.55亿,15892,1993-05-05,--,,--,港口装卸仓储业务、港口配套业务、保税物流业务,从事集装箱和散杂货的港口装卸、仓储、运输及其它配套服务
484,001896,豫能控股,河南豫能控股股份有限公司,河南,郑州市,--,--,2409,1998-01-22,--,,火电,发电、供热、煤炭,火电项目的投资管理、煤炭物流、新能源、综合能源服务等。
485,001914,招商积余,招商局积余产业运营服务股份有限公司,广东,深圳市,105.91亿,4.53亿,44761,1994-09-28,--,,--,物业管理业务、资产管理业务,物业资产管理与服务。
486,001965,招商公路,招商局公路网络科技控股股份有限公司,天津,天津市,86.26亿,55.41亿,5459,2017-12-25,--,,--,投资运营、交通科技、智慧交通,公路相关的经营收费公路业务和交通科技业务。
487,001979,招商蛇口,招商局蛇口工业区控股股份有限公司,广东,深圳市,1606.43亿,152.02亿,54735,2015-12-30,--,,房地产开发,园区开发与运营、社区开发与运营、邮轮产业建设与运营,园区开发与运营、社区开发与运营、邮轮产业建设与运营。
488,002001,新和成,浙江新和成股份有限公司,浙江,绍兴市,--,--,10100,2004-06-25,--,,化学原料药,营养品、香精香料,营养品、香精香料、高分子新材料的生产和销售。
489,002002,鸿达兴业,鸿达兴业股份有限公司,江苏,扬州市,--,--,4951,2004-06-25,--,,其他化学制品,PVC新材料、环境修复工程服务、防疫产品、工业原材料现货电子交易、综合物流服务及信息技术支持、稀土新材料,氢能源产业、化工产业、新材料产业、大环保产业、电子交易平台综合服务。
490,002003,伟星股份,浙江伟星实业发展股份有限公司,浙江,台州市,--,--,7785,2004-06-25,--,,服饰辅料,纺织服装、服饰、软件和信息技术服务,从事各类中高档服饰辅料产品的研发、生产与销售。
491,002004,华邦健康,华邦生命健康股份有限公司,重庆,重庆市,123.59亿,9.25亿,12206,2004-06-25,--,,农药,医药业务、医疗业务、农化业务,医药及农化、新材料产品的研发、生产、销售，医疗服务、旅游投资及运营业务。
492,002005,ST德豪,安徽德豪润达电气股份有限公司,安徽,蚌埠市,--,--,7407,2004-06-25,--,,LED,小家电、LED产品,小家电业务和LED封装业务。
493,002006,精功科技,浙江精功科技股份有限公司,浙江,绍兴市,17.28亿,1.03亿,1232,2004-06-25,--,,其他专用机械,太阳能光伏专用装备、新型建筑节能专用设备、轻纺专用设备、碳纤维及复合材料装备、机器人及智能装备、精密制造加工业务及军民融合项目开发,从事碳纤维及复合材料装备、机器人及智能装备、太阳能光伏专用装备、新型建筑节能专用设备、轻纺专用设备等高新技术产品的研制开发、生产销售和技术服务以及精密制造加工业务和军民融合项目开发。
494,002007,华兰生物,华兰生物工程股份有限公司,河南,新乡市,44.36亿,14.54亿,2927,2004-06-25,--,,生物医药,血液制品业务、疫苗制品、创新药和生物类似药,血液制品、疫苗、基因工程产品研发、生产和销售。
495,002008,大族激光,大族激光科技产业集团股份有限公司,广东,深圳市,163.32亿,20.80亿,15460,2004-06-25,--,,电子零部件,其他专用设备,主要从事激光加工设备的研发、生产与销售。
496,002009,天奇股份,天奇自动化工程股份有限公司,江苏,无锡市,--,--,2943,2004-06-29,--,,智能装备,智能装备、循环装备、汽车后市场、重工装备,以汽车智能装备、智能仓储、散料输送及智慧工业服务为主的智能装备产业;以废钢加工设备、报废汽车拆解设备、有色金属加工及分选设备为主的循环装备产业;以报废汽车回收拆解、汽车核心零部件再制造及动力电池回收资源化利用为主的汽车后市场产业;以风电铸件业务为主的重工装备产业。
497,002010,传化智联,传化智联股份有限公司,浙江,杭州市,--,--,5189,2004-06-29,--,,印染化学品,化工、物流,传化网智能物流业务与化工业务。
498,002011,盾安环境,浙江盾安人工环境股份有限公司,浙江,杭州市,--,--,11284,2004-07-05,--,,制冷配件,制冷配件业务、商用制冷空调设备业务,包括制冷元器件、制冷空调设备的研发、生产和销售。
